[
  {"id":"jyotish","term_dev":"ज्योतिष","term_lat":"Jyotish","meaning":"खगोल आ फलित के भारतीय पद्धति; निरयण पंचांग, कुंडली आ नियम, जेकर गणना ई ऐप करेला।","related":["panchang","kundli"]},
  {"id":"panchang","term_dev":"पंचांग","term_lat":"Panchang","meaning":"दिन के पाँच अंग वाला पंचांग: तिथि, नक्षत्र, योग, करण आ वार, संगे सूर्योदय के हिसाब से समय।","related":["tithi","nakshatra","yoga","karana","vara"]},
  {"id":"tithi","term_dev":"तिथि","term_lat":"Tithi","meaning":"चांद्र दिन: सूर्य से चंद्र के बढ़त के हर 12°; 30 तिथि से एक चांद्र महीना बनेला आ ऊ कवनो भी घरी शुरू हो सकेला।","related":["paksha","udaya","kshaya-tithi"]},
  {"id":"nakshatra","term_dev":"नक्षत्र","term_lat":"Nakshatra","meaning":"निरयण राशिचक्र पर 13°20' के 27 नक्षत्र में से एगो; चंद्र के नक्षत्र दिन के आ जनम-तारा के नाँव तय करेला।","related":["pada","janma-nakshatra","tara-bala"]},
  {"id":"yoga","term_dev":"योग","term_lat":"Yoga","meaning":"सूर्य आ चंद्र के भोगांश के जोड़ से बनल पंचांग-अंग, 13°20' के 27 विभाग; खास दिन-योग से अलग।","related":["panchang","amrit-siddhi"]},
  {"id":"karana","term_dev":"करण","term_lat":"Karana","meaning":"आधा तिथि; एगारह नाँव वाला करण, जवना में से विष्टि (भद्रा) ऊ बा जेकरा पंचांग संकेत के रूप में देखावेला।","related":["tithi","vishti","bhadra"]},
  {"id":"vara","term_dev":"वार","term_lat":"Vara","meaning":"वार, जे सूर्योदय से सूर्योदय ले गिनल जाला; एकर स्वामी (सूर्य, चंद्र, मंगल, बुध, गुरु, शुक्र, शनि) होरा-चक्र शुरू करेला।","related":["hora","panchang"]},
  {"id":"paksha","term_dev":"पक्ष","term_lat":"Paksha","meaning":"चांद्र पखवारा: शुक्ल (बढ़त चंद्र, अमावस्या से पूर्णिमा) भा कृष्ण (घटत चंद्र, पूर्णिमा से अमावस्या)।","related":["shukla-paksha","krishna-paksha"]},
  {"id":"shukla-paksha","term_dev":"शुक्ल पक्ष","term_lat":"Shukla paksha","meaning":"अमावस्या से पूर्णिमा ले के उजियार पखवारा, जब चंद्र बढ़ेला।","related":["paksha","purnima"]},
  {"id":"krishna-paksha","term_dev":"कृष्ण पक्ष","term_lat":"Krishna paksha","meaning":"पूर्णिमा से अमावस्या ले के अन्हार पखवारा, जब चंद्र घटेला।","related":["paksha","amavasya"]},
  {"id":"pratipada","term_dev":"प्रतिपदा","term_lat":"Pratipada","meaning":"दुनो पक्ष के पहिला तिथि; अमांत पद्धति में शुक्ल प्रतिपदा से चांद्र महीना शुरू होला।","related":["tithi","amanta"]},
  {"id":"dwitiya","term_dev":"द्वितीया","term_lat":"Dwitiya","meaning":"पक्ष के दूसरा तिथि (भइया दूज कातिक शुक्ल द्वितीया होला)।","related":["tithi"]},
  {"id":"tritiya","term_dev":"तृतीया","term_lat":"Tritiya","meaning":"पक्ष के तीसरा तिथि (अखतीज माने अक्षय तृतीया, तीनों तीज)।","related":["tithi"]},
  {"id":"chaturthi","term_dev":"चतुर्थी","term_lat":"Chaturthi","meaning":"चउथा तिथि; शुक्ल चतुर्थी विनायक होला, कृष्ण चतुर्थी संकष्टी।","related":["tithi","sankashti","vinayaka-chaturthi"]},
  {"id":"panchami","term_dev":"पंचमी","term_lat":"Panchami","meaning":"पक्ष के पाँचवाँ तिथि (बसंत पंचमी, नाग पंचमी)।","related":["tithi"]},
  {"id":"shashthi","term_dev":"षष्ठी","term_lat":"Shashthi","meaning":"पक्ष के छठा तिथि (छठ, स्कंद षष्ठी)।","related":["tithi","chhath"]},
  {"id":"saptami","term_dev":"सप्तमी","term_lat":"Saptami","meaning":"पक्ष के सातवाँ तिथि (रथ सप्तमी)।","related":["tithi"]},
  {"id":"ashtami","term_dev":"अष्टमी","term_lat":"Ashtami","meaning":"पक्ष के आठवाँ तिथि (जन्माष्टमी, दुर्गा अष्टमी, अहोई अष्टमी)।","related":["tithi"]},
  {"id":"navami","term_dev":"नवमी","term_lat":"Navami","meaning":"पक्ष के नउवाँ तिथि (रामनवमी, महानवमी)।","related":["tithi"]},
  {"id":"dashami","term_dev":"दशमी","term_lat":"Dashami","meaning":"पक्ष के दसवाँ तिथि (विजयादशमी)।","related":["tithi"]},
  {"id":"ekadashi","term_dev":"एकादशी","term_lat":"Ekadashi","meaning":"एगारहवाँ तिथि, जे महीना में दू बेर बरत के रूप में राखल जाला; हर एक के आपन नाँव बा (निर्जला, देवशयनी, मोक्षदा...)।","related":["tithi","parana","hari-vasara","smarta","vaishnava"]},
  {"id":"dwadashi","term_dev":"द्वादशी","term_lat":"Dwadashi","meaning":"बारहवाँ तिथि; एकादशी के बरत एकरा भीतर खोलल जाला (पारन)।","related":["tithi","parana"]},
  {"id":"trayodashi","term_dev":"त्रयोदशी","term_lat":"Trayodashi","meaning":"तेरहवाँ तिथि; जब ई सूर्यास्त के बाद चलत होखे त प्रदोष राखल जाला; धनतेरस कातिक कृष्ण त्रयोदशी होला।","related":["tithi","pradosh"]},
  {"id":"chaturdashi","term_dev":"चतुर्दशी","term_lat":"Chaturdashi","meaning":"चौदहवाँ तिथि; अधरतिया में कृष्ण चतुर्दशी शिवरात्रि होला।","related":["tithi","nishita"]},
  {"id":"purnima","term_dev":"पूर्णिमा","term_lat":"Purnima","meaning":"पूरा चंद्र के तिथि, शुक्ल पक्ष के पनरहवाँ; पूर्णिमांत पद्धति में एकरा से महीना खतम होला।","related":["tithi","purnimanta","amavasya"]},
  {"id":"amavasya","term_dev":"अमावस्या","term_lat":"Amavasya","meaning":"ऊ तिथि जब चंद्र ना लउकेलन, कृष्ण पक्ष के पनरहवाँ; अमांत पद्धति में एकरा से महीना खतम होला।","related":["tithi","amanta","purnima"]},
  {"id":"amanta","term_dev":"अमांत","term_lat":"Amanta","meaning":"महीना-गणना जवना में चांद्र महीना अमावस्या पर खतम होला; भारत के दक्खिन आ पच्छिम में चलेला।","related":["purnimanta","amavasya"]},
  {"id":"purnimanta","term_dev":"पूर्णिमांत","term_lat":"Purnimanta","meaning":"महीना-गणना जवना में चांद्र महीना पूर्णिमा पर खतम होला; उत्तर में चलेला। कृष्ण पक्ष के महीना अगिला नाँव लेला।","related":["amanta","purnima"]},
  {"id":"adhik-maas","term_dev":"अधिक मास","term_lat":"Adhik maas","meaning":"अतिरिक्त चांद्र महीना, जे तब जोड़ल जाला जब कवनो चांद्र महीना में कवनो संक्रांति ना पड़े; एह में कवनो पर्व ना होला।","related":["sankranti","kshaya-maas"]},
  {"id":"kshaya-maas","term_dev":"क्षय मास","term_lat":"Kshaya maas","meaning":"ऊ चांद्र महीना जवना में दू संक्रांति पड़ेला आ जेकरा क्रम से हटा दिहल जाला; बहुत कम होला।","related":["adhik-maas","sankranti"]},
  {"id":"kshaya-tithi","term_dev":"क्षय तिथि","term_lat":"Kshaya tithi","meaning":"ऊ तिथि जे दू सूर्योदय के बीच शुरू हो के खतम हो जाला आ एह से कवनो सूर्योदय के ना छुवे; एकरा ओही दिन के मानल जाला जवना दिन ई शुरू भइल।","related":["tithi","udaya"]},
  {"id":"vriddhi-tithi","term_dev":"वृद्धि तिथि","term_lat":"Vriddhi tithi","meaning":"ऊ तिथि जे दू सूर्योदय पर रहेला; अधिकतर पर्व पहिला दिन लेला, जब ले ओकर नियम बाद वाला दिन ना चुने।","related":["tithi","udaya"]},
  {"id":"samvat","term_dev":"संवत","term_lat":"Samvat","meaning":"साल के गिनती। विक्रम संवत (शक + 135) आ शक संवत दुनो इहाँ चइत शुक्ल प्रतिपदा के बदलेला।","related":["vikram-samvat","shaka-samvat"]},
  {"id":"vikram-samvat","term_dev":"विक्रम संवत","term_lat":"Vikram Samvat","meaning":"उत्तर में चले वाला साल के गिनती; चइत शुक्ल प्रतिपदा से कैलेंडर साल से 57 साल आगे।","related":["samvat"]},
  {"id":"shaka-samvat","term_dev":"शक संवत","term_lat":"Shaka Samvat","meaning":"भारतीय राष्ट्रीय पंचांग के साल के गिनती; चइत शुक्ल प्रतिपदा के बाद कैलेंडर साल में से 78 घटावल।","related":["samvat"]},
  {"id":"sankranti","term_dev":"संक्रांति","term_lat":"Sankranti","meaning":"सूर्य के कवनो निरयण राशि में प्रवेश; ई सौर महीना के नाँव तय करेला आ खिचड़ी (मकर संक्रांति) जइसन पर्व के तारीख देला।","related":["makara","ayanamsa","adhik-maas"]},
  {"id":"ayana","term_dev":"अयन","term_lat":"Ayana","meaning":"सूर्य के आधा साल: उत्तरायण (उत्तर ओर) भा दक्षिणायन (दक्खिन ओर); इहाँ निरयण, मकर आ कर्क से।","related":["uttarayana","dakshinayana"]},
  {"id":"uttarayana","term_dev":"उत्तरायण","term_lat":"Uttarayana","meaning":"सूर्य के उत्तर ओर के आधा साल, मकर संक्रांति से कर्क संक्रांति ले।","related":["ayana","dakshinayana"]},
  {"id":"dakshinayana","term_dev":"दक्षिणायन","term_lat":"Dakshinayana","meaning":"सूर्य के दक्खिन ओर के आधा साल, कर्क संक्रांति से मकर संक्रांति ले।","related":["ayana","uttarayana"]},
  {"id":"ritu","term_dev":"ऋतु","term_lat":"Ritu","meaning":"दू-दू सौर महीना के छव ऋतु में से एगो: वसंत, ग्रीष्म, वर्षा, शरद, हेमंत, शिशिर।","related":["vasanta","grishma","varsha","sharad","hemanta","shishira"]},
  {"id":"vasanta","term_dev":"वसंत","term_lat":"Vasanta","meaning":"बसंत के ऋतु; सूर्य मीन आ मेष में (निरयण)।","related":["ritu"]},
  {"id":"grishma","term_dev":"ग्रीष्म","term_lat":"Grishma","meaning":"गरमी के ऋतु; सूर्य वृषभ आ मिथुन में (निरयण)।","related":["ritu"]},
  {"id":"varsha","term_dev":"वर्षा","term_lat":"Varsha","meaning":"बरसात के ऋतु; सूर्य कर्क आ सिंह में (निरयण)।","related":["ritu"]},
  {"id":"sharad","term_dev":"शरद","term_lat":"Sharad","meaning":"शरद के ऋतु (जाड़ा से पहिले); सूर्य कन्या आ तुला में (निरयण)। नवरात (शारदीय) आ सरद पुर्निमा एही में पड़ेला।","related":["ritu"]},
  {"id":"hemanta","term_dev":"हेमंत","term_lat":"Hemanta","meaning":"शुरुआती जाड़ा (हेमंत); सूर्य वृश्चिक आ धनु में (निरयण)।","related":["ritu"]},
  {"id":"shishira","term_dev":"शिशिर","term_lat":"Shishira","meaning":"जाड़ा के अंतिम हिस्सा (शिशिर); सूर्य मकर आ कुंभ में (निरयण)।","related":["ritu"]},
  {"id":"muhurta","term_dev":"मुहूर्त","term_lat":"Muhurta","meaning":"48 मिनट के इकाई (दिन के तीसवाँ हिस्सा) आ, एही से, कवनो काम खातिर चुनल शुभ बेला।","related":["abhijit","brahma-muhurta","choghadiya"]},
  {"id":"abhijit","term_dev":"अभिजित","term_lat":"Abhijit","meaning":"दिन के पनरह मुहूर्त में आठवाँ, स्थानीय दुपहरिया पर केंद्रित; इहाँ हर वार के अनुकूल गिनल जाला।","related":["muhurta","madhyahna"]},
  {"id":"brahma-muhurta","term_dev":"ब्रह्म मुहूर्त","term_lat":"Brahma muhurta","meaning":"सूर्योदय से 96 से 48 मिनट पहिले के मुहूर्त, जेकरा शांत साधना खातिर राखल जाला।","related":["muhurta"]},
  {"id":"rahu-kaal","term_dev":"राहु काल","term_lat":"Rahu Kaal","meaning":"दिनमान के आठवाँ हिस्सा, जे वार से तय होला आ नया शुरुआत खातिर एकरा से बचल जाला।","related":["yamaganda","gulika","rahu"]},
  {"id":"yamaganda","term_dev":"यमगंड","term_lat":"Yamaganda","meaning":"दिनमान के दूसरा बचे वाला आठवाँ हिस्सा, जे राहु काल जइसन वार से तय होला।","related":["rahu-kaal","gulika"]},
  {"id":"gulika","term_dev":"गुलिक","term_lat":"Gulika","meaning":"दिन के शनि के हिस्सा (मांदी भी कहाला): दिनमान के आठवाँ हिस्सा, जे वार से तय होला आ शुरुआत खातिर एकरा से बचल जाला।","related":["rahu-kaal","yamaganda","saturn"]},